<?xml version="1.0" encoding="UTF-8"?>
<!DOCTYPE toc SYSTEM "../../../toc.dtd">

<!--
  * 000003.xml
  *
  * Copyright (c) 2003-2010 John Willinsky
  * Distributed under the GNU GPL v2. For full terms see the file docs/COPYING.
  *
  * Tabla de Contenidos de la Administración de la Revista - Roles. 
  *
  * Translated by Juan Arias, Corporación Parque Tecnológico de Mérida: juanarias@ula.ve.
  *
  * $Id$
  -->

<toc id="journal/toc/000003" locale="en_US" title="Roles" parent_topic="journal/topic/000003">
	<topic id="journal/topic/000015" title="Administrador de la Revista" />
	<topic id="journal/topic/000016" title="Editor" />
	<topic id="journal/topic/000017" title="Editor de la Sección" />
	<topic id="journal/topic/000019" title="Corrector de Pruebas" />
	<topic id="journal/topic/000018" title="Editor de Diagramación" />
	<topic id="journal/topic/000020" title="Corrector de Pruebas" />
	<topic id="journal/topic/000021" title="Revisor" />
	<topic id="journal/topic/000022" title="Autor" />
	<topic id="journal/topic/000023" title="Lector" />
	<topic id="journal/topic/000032" title="Administrador de las suscripciones" />

	<breadcrumb url="journal/topic/000000" title="Administrador de la Revista" />
	<breadcrumb url="journal/topic/000003" title="Roles" />
</toc>
